{
  "schema_version": "1.0",
  "output_id": "OUT-DEMO",
  "model_version": "demo-v0",
  "checkpoint_sha256": null,
  "source_data_hashes": [
    "0000000000000000000000000000000000000000000000000000000000000000"
  ],
  "input_hash": "1111111111111111111111111111111111111111111111111111111111111111",
  "parameter_hash": "2222222222222222222222222222222222222222222222222222222222222222",
  "seed": 42,
  "environment_hash": "3333333333333333333333333333333333333333333333333333333333333333",
  "output_hash": "4444444444444444444444444444444444444444444444444444444444444444",
  "validation_status": "SYNTHETIC_SOFTWARE_ONLY",
  "payload_uri": "relative://synthetic/output.tsv"
}
